{
  "squadId": "payments",
  "displayName": "Payments",
  "generatedAt": "2026-08-06T08:00:00.000Z",
  "timezone": "America/New_York",
  "activeSprint": {
    "id": 88,
    "name": "Pay Sprint 12",
    "state": "active",
    "startDate": "2026-07-28T09:00:00.000Z",
    "endDate": "2026-08-11T17:00:00.000Z",
    "elapsedFraction": 0.55
  },
  "workItems": [
    {
      "key": "PAY-50",
      "summary": "Payment gateway timeout handling",
      "projectKey": "PAY",
      "boardType": "scrum",
      "sprintIds": [88],
      "issueType": "Story",
      "priorityTier": "P1",
      "statusName": "In Progress",
      "statusCategory": "inProgress",
      "assigneeDisplayName": "Sam Rivera",
      "storyPoints": 5,
      "createdAt": "2026-07-20T10:00:00.000Z",
      "updatedAt": "2026-08-05T10:00:00.000Z",
      "ageInCurrentStatusBusinessDays": 2,
      "daysSinceMeaningfulUpdate": 2,
      "linkedIssues": [{ "key": "SF-102", "linkType": "blocks", "otherSquadId": "storefront" }],
      "wasInPreviousSprint": false
    },
    {
      "key": "PAY-51",
      "summary": "Refund API endpoint",
      "projectKey": "PAY",
      "boardType": "kanban",
      "issueType": "Story",
      "priorityTier": "P2",
      "statusName": "In Progress",
      "statusCategory": "inProgress",
      "assigneeDisplayName": "Casey Kim",
      "storyPoints": 3,
      "createdAt": "2026-07-15T10:00:00.000Z",
      "updatedAt": "2026-07-18T10:00:00.000Z",
      "ageInCurrentStatusBusinessDays": 8,
      "daysSinceMeaningfulUpdate": 8,
      "wasInPreviousSprint": false
    },
    {
      "key": "PAY-52",
      "summary": "Invoice generation",
      "projectKey": "PAY",
      "boardType": "scrum",
      "sprintIds": [88],
      "issueType": "Story",
      "priorityTier": "P0",
      "statusName": "In Progress",
      "statusCategory": "inProgress",
      "assigneeDisplayName": "Sam Rivera",
      "storyPoints": 8,
      "createdAt": "2026-07-29T10:00:00.000Z",
      "updatedAt": "2026-08-06T08:00:00.000Z",
      "ageInCurrentStatusBusinessDays": 1,
      "daysSinceMeaningfulUpdate": 0,
      "wasInPreviousSprint": false
    },
    {
      "key": "PAY-53",
      "summary": "Unassigned critical fix",
      "projectKey": "PAY",
      "boardType": "scrum",
      "sprintIds": [88],
      "issueType": "Bug",
      "priorityTier": "P0",
      "statusName": "Open",
      "statusCategory": "notStarted",
      "assigneeDisplayName": null,
      "storyPoints": null,
      "createdAt": "2026-08-01T10:00:00.000Z",
      "updatedAt": "2026-08-01T10:00:00.000Z",
      "ageInCurrentStatusBusinessDays": 3,
      "daysSinceMeaningfulUpdate": 3,
      "wasInPreviousSprint": false
    }
  ],
  "retrievalMeta": {
    "issueCount": 4,
    "cap": 500,
    "truncated": false,
    "scrumScope": "active+previous sprint",
    "kanbanScope": "open+30d closed"
  }
}
