{
  "squadId": "storefront",
  "displayName": "Storefront",
  "generatedAt": "2026-08-06T08:00:00.000Z",
  "timezone": "America/New_York",
  "activeSprint": {
    "id": 42,
    "name": "SF Sprint 24",
    "state": "active",
    "startDate": "2026-07-28T09:00:00.000Z",
    "endDate": "2026-08-11T17:00:00.000Z",
    "elapsedFraction": 0.6
  },
  "previousSprint": {
    "id": 41,
    "name": "SF Sprint 23",
    "state": "closed",
    "startDate": "2026-07-14T09:00:00.000Z",
    "endDate": "2026-07-27T17:00:00.000Z"
  },
  "workItems": [
    {
      "key": "SF-101",
      "summary": "Checkout redesign",
      "projectKey": "SF",
      "boardType": "scrum",
      "sprintIds": [42],
      "issueType": "Story",
      "priorityTier": "P2",
      "statusName": "In Progress",
      "statusCategory": "inProgress",
      "assigneeDisplayName": "Alex Chen",
      "storyPoints": 5,
      "createdAt": "2026-07-01T10:00:00.000Z",
      "updatedAt": "2026-07-20T10:00:00.000Z",
      "ageInCurrentStatusBusinessDays": 12,
      "daysSinceMeaningfulUpdate": 12,
      "labels": ["checkout"],
      "components": ["Web"],
      "linkedIssues": [],
      "isBlockedFlag": false,
      "wasInPreviousSprint": false
    },
    {
      "key": "SF-102",
      "summary": "Product page performance",
      "projectKey": "SF",
      "boardType": "scrum",
      "sprintIds": [42],
      "issueType": "Story",
      "priorityTier": "P1",
      "statusName": "Blocked",
      "statusCategory": "blocked",
      "assigneeDisplayName": null,
      "storyPoints": 3,
      "createdAt": "2026-07-25T10:00:00.000Z",
      "updatedAt": "2026-08-01T10:00:00.000Z",
      "ageInCurrentStatusBusinessDays": 3,
      "daysSinceMeaningfulUpdate": 3,
      "linkedIssues": [{ "key": "PAY-50", "linkType": "is blocked by", "otherSquadId": "payments" }],
      "isBlockedFlag": true,
      "wasInPreviousSprint": false
    },
    {
      "key": "SF-103",
      "summary": "Header navigation update",
      "projectKey": "SF",
      "boardType": "scrum",
      "sprintIds": [42],
      "issueType": "Story",
      "priorityTier": "P2",
      "statusName": "In Progress",
      "statusCategory": "inProgress",
      "assigneeDisplayName": "Jordan Lee",
      "storyPoints": 2,
      "createdAt": "2026-07-29T10:00:00.000Z",
      "updatedAt": "2026-08-05T10:00:00.000Z",
      "ageInCurrentStatusBusinessDays": 1,
      "daysSinceMeaningfulUpdate": 1,
      "wasInPreviousSprint": false
    },
    {
      "key": "SF-104",
      "summary": "Footer links fix",
      "projectKey": "SF",
      "boardType": "scrum",
      "sprintIds": [42],
      "issueType": "Story",
      "priorityTier": "P3",
      "statusName": "In Progress",
      "statusCategory": "inProgress",
      "assigneeDisplayName": "Alex Chen",
      "storyPoints": null,
      "createdAt": "2026-08-01T10:00:00.000Z",
      "updatedAt": "2026-08-04T10:00:00.000Z",
      "ageInCurrentStatusBusinessDays": 2,
      "daysSinceMeaningfulUpdate": 2,
      "wasInPreviousSprint": false
    },
    {
      "key": "SF-105",
      "summary": "Search autocomplete",
      "projectKey": "SF",
      "boardType": "scrum",
      "sprintIds": [42],
      "issueType": "Story",
      "priorityTier": "P2",
      "statusName": "To Do",
      "statusCategory": "notStarted",
      "assigneeDisplayName": "Jordan Lee",
      "storyPoints": 3,
      "createdAt": "2026-08-02T10:00:00.000Z",
      "updatedAt": "2026-08-02T10:00:00.000Z",
      "ageInCurrentStatusBusinessDays": 0,
      "daysSinceMeaningfulUpdate": 0,
      "addedAfterSprintStart": true,
      "wasInPreviousSprint": false
    }
  ],
  "retrievalMeta": {
    "issueCount": 5,
    "cap": 500,
    "truncated": false,
    "scrumScope": "active+previous sprint"
  },
  "limitations": []
}
